<?xml version="1.0" encoding="UTF-8" ?>
<!DOCTYPE testproblem SYSTEM "regressiontest.dtd">

<testproblem>
  <name>MY</name>
  <owner userid="piggott"/>
  <tags>flml</tags>
  <problem_definition length="special" nprocs="1">
    <command_line>dfluidity -v3 -x MY.flml &gt; MY.log 2&gt;&amp;1; </command_line>
  </problem_definition>
  <variables>
  </variables>
  <pass_tests>
  </pass_tests>
  <warn_tests>
  </warn_tests>
</testproblem>
