<?xml version="1.0" encoding="UTF-8" ?>
<!DOCTYPE testproblem SYSTEM "regressiontest.dtd">

<testproblem>
  <name>Internal Wave</name>
  <owner userid="bmartin"/>
  <tags>flml</tags>
  <problem_definition length="medium" nprocs="1">
    <command_line>fluidity -v3 -l --xml internal_wave.flml &gt; /dev/null 2&gt;&amp;1</command_line>
  </problem_definition>
  <variables>
    <variable name="speednorm" language="python">
import fluidity_tools
speednorm =fluidity_tools.stat_parser("InternalWave.stat")['StratifiedFluid']['Velocity%magnitude']['l2norm'][-1]
    </variable>
  </variables>
  <pass_tests>
    <!-- l2norm should remain within 1% of a constant detemined analytically -->
    <test name="l2norm(speed) at last timestep" language="python">
assert abs(speednorm - 0.0017479) &lt; 0.0000175
    </test>
  </pass_tests>
  <warn_tests>
  </warn_tests>
</testproblem>
