<?xml version="1.0" encoding="UTF-8" ?>
<!DOCTYPE testproblem SYSTEM "regressiontest.dtd">

<testproblem>
  <name>Control volume, multi-material flow test</name>
  <owner userid="cwilson"/>
  <tags>flml solidity</tags>
    <problem_definition length="special" nprocs="1">
    <command_line>dfluidity -v2 -l cv_diffusion_input.flml </command_line>
  </problem_definition>  
  <variables>  
  </variables>
    <pass_tests>  
  </pass_tests>
  <warn_tests>
  </warn_tests>
</testproblem>
