<?xml version="1.0" encoding="UTF-8" ?>
<!DOCTYPE testproblem SYSTEM "regressiontest.dtd">

<testproblem>
  <name>BL_test_1d</name>
  <owner userid="Bob"/>
  <tags></tags>
  <problem_definition length="medium" nprocs="1">
    <command_line>
       ../../bin/MultiphasePrototype.bin input.dat
    </command_line>
    <!-- One dimensional problem for BL equation -->
  </problem_definition>
  <variables>

  </variables>
  <pass_tests>

  </pass_tests>
  <warn_tests>
  </warn_tests>
</testproblem>
