<?xml version="1.0" encoding="UTF-8" ?>
<!DOCTYPE testproblem SYSTEM "regressiontest.dtd">

<testproblem>
  <name>hyperlight-bbop</name>
  <owner userid="ml805"/>
  <tags>flml hyperlight</tags>
    <problem_definition length="special" nprocs="1">
    <command_line>fluidity hyperlight-bbop.flml -l -v2  </command_line>
  </problem_definition>  
  <variables>  
    <variable name="FinalIrradianceMin" language="python">
import fluidity_tools
FinalIrradianceMin = fluidity_tools.stat_parser("hyperlight-bbop.stat")['Fluid']['IrradiancePAR']['min'][-1]
    </variable>    
  </variables>    

  <pass_tests> 
    <test name="Final irradiance greater 0" language="python">assert FinalIrradianceMin &gt; 0</test>
  </pass_tests>
</testproblem>
